job_role,skills,domain,required_skills,demand_level_india,experience_alignment
Lead Full Stack Developer,"customer service, design, management, networking",Misc,"networking, data analysis, cloud computing, machine learning, analytics, design",Medium,Advanced
Principal Cardiologist,"project planning, documentation, cloud computing, networking",Construction,"documentation, security, project planning, research, communication, design",Medium,Intermediate
Principal Network Administrator,"teamwork, communication, python, design",Business,"project planning, problem solving, customer service, analytics, programming, security",High,Intermediate
Principal Radiologist,"automation, project planning, analytics, python",Government,"teamwork, communication, programming, python, security, machine learning",High,Beginner
Senior Network Administrator,"machine learning, automation, management, design",Agriculture,"automation, cloud computing, analytics, design, customer service, documentation",High,Advanced
Senior Emergency Medical Technician,"research, management, automation, data analysis",Agriculture,"problem solving, documentation, communication, machine learning, data analysis, design",Medium,Advanced
Assistant Clinical Psychologist,"cloud computing, management, documentation, python",Construction,"problem solving, documentation, machine learning, design, data analysis, security",High,Intermediate
Lead Dentist,"analytics, teamwork, communication, data analysis",Engineering,"machine learning, project planning, problem solving, documentation, customer service, management",Medium,Beginner
Junior General Physician,"problem solving, teamwork, programming, communication",Transport,"security, teamwork, research, management, programming, networking",Medium,Advanced
Senior Neurologist,"automation, analytics, design, project planning",Agriculture,"networking, research, teamwork, design, machine learning, automation",High,Intermediate
Pathologist,"problem solving, data analysis, communication, machine learning",Construction,"research, machine learning, project planning, communication, programming, security",Medium,Intermediate
Optician,"machine learning, python, teamwork, communication",Engineering,"documentation, machine learning, project planning, security, problem solving, python",Medium,Advanced
Senior Computer Network Architect,"analytics, automation, security, problem solving",Agriculture,"problem solving, security, teamwork, data analysis, project planning, python",Medium,Advanced
Principal Hospital Administrator,"cloud computing, teamwork, networking, programming",Government,"automation, python, problem solving, research, project planning, programming",High,Intermediate
QA Engineer,"customer service, cloud computing, teamwork, automation",Education,"customer service, problem solving, project planning, security, cloud computing, programming",High,Intermediate
Assistant Computer Network Architect,"python, automation, documentation, data analysis",Creative,"problem solving, programming, networking, research, automation, analytics",Medium,Beginner
Junior Neurologist,"automation, problem solving, python, documentation",Hospitality,"security, cloud computing, project planning, data analysis, research, documentation",Medium,Intermediate
Senior Embedded Systems Engineer,"automation, project planning, management, machine learning",Misc,"analytics, problem solving, cloud computing, communication, project planning, python",Medium,Intermediate
Junior Surgeon,"teamwork, data analysis, analytics, machine learning",Government,"security, programming, networking, data analysis, customer service, automation",High,Beginner
Principal Medical Researcher,"teamwork, machine learning, management, analytics",Healthcare,"networking, research, security, design, automation, python",Medium,Beginner
Junior Blockchain Developer,"machine learning, cloud computing, design, problem solving",Transport,"customer service, analytics, security, cloud computing, networking, problem solving",Medium,Intermediate
Principal UI Designer,"security, management, automation, data analysis",Education,"teamwork, design, analytics, management, machine learning, python",Medium,Intermediate
Principal Psychiatrist,"python, management, data analysis, project planning",Healthcare,"security, networking, cloud computing, data analysis, communication, customer service",Medium,Beginner
Software Architect,"networking, programming, analytics, data analysis",Hospitality,"problem solving, analytics, security, python, data analysis, machine learning",Medium,Advanced
Principal Surgeon,"communication, networking, python, management",Creative,"documentation, communication, design, customer service, programming, project planning",Medium,Intermediate
Lead Midwife,"management, problem solving, analytics, documentation",Transport,"management, data analysis, programming, communication, security, documentation",High,Beginner
Principal Blockchain Developer,"analytics, research, teamwork, communication",Transport,"data analysis, project planning, networking, cloud computing, teamwork, programming",Medium,Advanced
Principal Physiotherapist,"design, python, communication, research",Engineering,"programming, customer service, project planning, security, documentation, analytics",Medium,Intermediate
Junior Ethical Hacker,"analytics, cloud computing, python, design",Creative,"security, machine learning, problem solving, data analysis, design, customer service",High,Intermediate
Junior Cardiologist,"management, analytics, communication, design",Misc,"design, teamwork, networking, problem solving, documentation, python",Medium,Advanced
Assistant Embedded Systems Engineer,"cloud computing, design, teamwork, programming",Construction,"communication, analytics, teamwork, data analysis, customer service, problem solving",Medium,Beginner
Principal Home Health Aide,"design, customer service, communication, project planning",Misc,"data analysis, customer service, programming, research, python, teamwork",High,Intermediate
Physical Therapist,"programming, analytics, management, python",Misc,"security, teamwork, data analysis, project planning, research, python",Medium,Intermediate
Principal General Physician,"teamwork, data analysis, cloud computing, python",Misc,"programming, automation, networking, design, cloud computing, documentation",Medium,Advanced
Lead Site Reliability Engineer,"cloud computing, programming, machine learning, management",Engineering,"machine learning, data analysis, project planning, teamwork, design, problem solving",High,Intermediate
Senior Veterinarian,"cloud computing, programming, security, teamwork",Healthcare,"communication, security, analytics, teamwork, research, customer service",Medium,Advanced
Software Engineer,"design, problem solving, communication, documentation",IT,"communication, networking, customer service, analytics, design, machine learning",High,Beginner
Senior General Physician,"machine learning, programming, python, management",Healthcare,"python, documentation, networking, security, automation, cloud computing",Medium,Intermediate
Nutritionist,"machine learning, networking, python, research",Creative,"python, customer service, documentation, security, design, teamwork",Medium,Intermediate
Assistant Systems Analyst,"management, documentation, project planning, data analysis",Education,"management, customer service, design, documentation, teamwork, python",Medium,Intermediate
AI Engineer,"automation, teamwork, communication, design",Transport,"networking, machine learning, programming, python, documentation, automation",Medium,Beginner
Lead AR/VR Developer,"cloud computing, python, design, automation",Misc,"data analysis, cloud computing, teamwork, python, project planning, automation",High,Beginner
Assistant Occupational Therapist,"analytics, security, project planning, design",Creative,"python, customer service, documentation, research, security, teamwork",Medium,Advanced
Assistant Pharmacy Technician,"automation, analytics, research, documentation",Construction,"machine learning, security, data analysis, research, networking, management",Medium,Beginner
Lead Orthopedic Surgeon,"programming, security, project planning, problem solving",Agriculture,"programming, machine learning, analytics, problem solving, design, research",Medium,Intermediate
Assistant Epidemiologist,"communication, machine learning, analytics, networking",Transport,"python, documentation, analytics, customer service, automation, management",Medium,Beginner
Systems Analyst,"project planning, networking, problem solving, customer service",Transport,"programming, data analysis, problem solving, networking, cloud computing, communication",High,Beginner
Medical Laboratory Technician,"design, machine learning, security, documentation",Healthcare,"research, customer service, documentation, teamwork, machine learning, data analysis",Medium,Beginner
Assistant DevOps Engineer,"research, teamwork, networking, customer service",Engineering,"communication, project planning, programming, research, data analysis, python",Medium,Intermediate
Assistant Game Developer,"problem solving, security, python, documentation",Transport,"security, documentation, design, analytics, automation, customer service",High,Intermediate
Assistant Web Developer,"networking, teamwork, documentation, analytics",Government,"communication, security, automation, design, customer service, networking",High,Beginner
Veterinarian,"problem solving, machine learning, project planning, management",Government,"communication, analytics, automation, design, cloud computing, security",Medium,Beginner
Principal Software Developer,"research, programming, data analysis, python",Education,"security, project planning, programming, python, cloud computing, problem solving",Medium,Intermediate
DevOps Engineer,"documentation, problem solving, design, data analysis",Healthcare,"programming, analytics, networking, teamwork, cloud computing, automation",High,Intermediate
Principal Audiologist,"research, problem solving, machine learning, customer service",Misc,"machine learning, research, documentation, automation, cloud computing, project planning",Medium,Beginner
Senior Software Developer,"research, machine learning, data analysis, teamwork",Hospitality,"teamwork, machine learning, programming, project planning, documentation, automation",High,Beginner
Senior UX Designer,"documentation, communication, python, machine learning",Misc,"automation, security, communication, customer service, management, teamwork",High,Intermediate
Senior AR/VR Developer,"security, programming, automation, networking",Construction,"teamwork, customer service, data analysis, management, networking, analytics",Medium,Beginner
Assistant Robotics Engineer,"machine learning, networking, problem solving, data analysis",Healthcare,"cloud computing, programming, automation, project planning, research, management",High,Intermediate
Assistant Network Engineer,"data analysis, automation, design, programming",Hospitality,"project planning, communication, documentation, management, programming, security",High,Intermediate
Junior Endocrinologist,"project planning, customer service, management, machine learning",Education,"automation, research, programming, analytics, cloud computing, data analysis",High,Intermediate
Orthopedic Surgeon,"management, security, cloud computing, communication",Engineering,"customer service, security, problem solving, teamwork, networking, design",High,Advanced
Principal Pharmacy Technician,"documentation, programming, design, customer service",Engineering,"documentation, programming, machine learning, teamwork, data analysis, automation",Medium,Advanced
Senior Software Architect,"project planning, cloud computing, python, design",IT,"documentation, project planning, data analysis, teamwork, security, customer service",Medium,Beginner
Principal Medical Assistant,"python, project planning, data analysis, security",Construction,"customer service, networking, python, automation, communication, documentation",Medium,Beginner
Occupational Therapist,"documentation, python, problem solving, design",Engineering,"machine learning, cloud computing, project planning, security, teamwork, networking",Medium,Beginner
Principal DevOps Engineer,"data analysis, networking, research, security",Healthcare,"cloud computing, python, communication, programming, security, automation",Medium,Advanced
Principal Systems Analyst,"research, communication, programming, teamwork",Education,"teamwork, security, design, cloud computing, automation, project planning",Medium,Beginner
Assistant UX Designer,"machine learning, communication, teamwork, automation",Hospitality,"teamwork, research, networking, communication, analytics, documentation",Medium,Advanced
Lead Frontend Developer,"management, communication, project planning, python",Hospitality,"python, customer service, problem solving, design, research, security",High,Advanced
Lead Gastroenterologist,"cloud computing, communication, programming, teamwork",IT,"networking, customer service, machine learning, analytics, documentation, data analysis",High,Intermediate
Lead Computer Programmer,"security, machine learning, communication, teamwork",Engineering,"analytics, design, networking, communication, project planning, machine learning",High,Intermediate
Senior Midwife,"machine learning, design, documentation, networking",Healthcare,"networking, management, security, python, design, customer service",Medium,Intermediate
Senior Endocrinologist,"analytics, research, programming, networking",Hospitality,"research, management, teamwork, cloud computing, problem solving, machine learning",Medium,Intermediate
Lead IT Consultant,"problem solving, management, security, documentation",Agriculture,"programming, documentation, networking, project planning, problem solving, research",High,Intermediate
Senior Microbiologist,"python, teamwork, customer service, documentation",Business,"research, networking, customer service, analytics, project planning, design",High,Advanced
Assistant Data Analyst,"python, cloud computing, customer service, automation",Misc,"automation, design, programming, research, documentation, machine learning",Medium,Beginner
Principal Clinical Psychologist,"cloud computing, python, management, automation",Engineering,"python, management, research, teamwork, automation, cloud computing",High,Intermediate
Lead Web Developer,"data analysis, security, project planning, communication",Education,"security, python, research, documentation, project planning, networking",High,Beginner
Junior Computer Hardware Engineer,"project planning, design, security, networking",Government,"machine learning, analytics, documentation, networking, python, teamwork",High,Advanced
Journalist,"writing, editing, journalism, research, storytelling, communication",Creative,"writing, editing, SEO, research, communication",High,Intermediate
Content Writer,"writing, editing, SEO, blogging, content creation",Creative,"SEO, writing, research, communication",High,Beginner
Copywriter,"copywriting, marketing, SEO, storytelling",Creative,"writing, SEO, marketing, communication",Medium,Intermediate
Editor,"editing, proofreading, writing, grammar",Creative,"editing, writing, communication",Medium,Intermediate
Social Media Manager,"social media, content creation, marketing, SEO",Creative,"marketing, SEO, analytics, communication",High,Intermediate